Your Name,In which program(s) are you a participant?,How much do you believe that you improved in working with clients in an independent capacity?,How much do you believe that you improved in giving a client real-time feedback?,How much do you believe that you improved in planning and facilitating meetings with clients?,How much do you believe that you improved in leading and managing a project from start to finish with little guidance from your client?,How much do you believe that you improved in designing clear and compelling solutions when provided with ambiguous information and support?,How much do you believe that you improved in synthesizing and presenting (written and verbal) complex information to clients in an accessible and actionable manner?,How useful do you believe your project and final deliverable was to your client organization?,How clear were expectations from your client about your project scope and deliverables?,How would you rate the time commitment and work load required of you by your client organization?,Would you recommend working with this client again in future years of this program or course?,"If you selected ""Maybe"" or ""No"" to the previous question, please explain.",To what extent did your experience meet your expectations for the program and/or course?,What aspect(s) of the program/course were most helpful to you in achieving your learning goals?,What suggestions for improvement do you have for future iterations of this program or course?,How supported did you feel by the program coordinator(s) and/or instructor in addressing challenges or roadblocks in your client project?,What resources did you find most helpful for your learning and/or completing your client project? - Selected Choice,What resources did you find most helpful for your learning and/or completing your client project? - Other - Text,Are you willing to share your experience in the program and/or course for marketing or student recruitment purposes in the future?,Is there anything else you would like to share about your experience in this program or course? (Optional)
Arijit Paladhi ,CONNECT,A moderate amount,A moderate amount,A moderate amount,A lot,A moderate amount,A moderate amount,Moderately useful,Somewhat clear,Slightly too much,Yes,,Equals expectations,"The end objective was unclear and the data was real-world and messy, so the challenge was to figure out how to answer questions within that framework. The constraint was inadvertently helpful at the end while delivering analysis.","Cleaner datasets, everything else was great. ",A great deal,"Client support and instruction,Consulting frameworks,Program mentors",,Yes,
Emily Acker,CONNECT,A moderate amount,A lot,A moderate amount,A lot,A great deal,A lot,Extremely useful,Extremely clear,About right,Yes,,Exceeds expectations,I appreciated that I was able to learn a new program (Indesign) and that I got to learn more about how AISD works. ,"I think future iterations of the program can improve by having a clearer funding protocol. I expect that since this was the pilot round, that will be improved for future students. ",A great deal,"Client support and instruction,Program mentors",,Yes,
Kat Sisler,CONNECT,A moderate amount,A moderate amount,A moderate amount,A moderate amount,A lot,A lot,Extremely useful,Somewhat clear,About right,Yes,,Exceeds expectations,"Not necessarily the most helpful, but something that was really important/noticeable: I appreciate that the CONNECT program was a low-maintenance addition to my job. What I mean by that was there wasn't a ton of meetings, extra written requirements, etc., and the ones that did exist felt valuable and necessary. You guys have really figured out a way to support projects without being overly burdensome. ","The project management tracker - I think it's a valuable resource but how helpful it will be varies on the project. It would be especially helpful for those who may be new to ""contracting"" or working short term projects, that way everyone can be on the same page about a deliverable, expectation, etc. ",A lot,Internet research,,Yes,"I know we've talked about this a little bit before and there's a logistical challenge to it, but if at any point you're able to extend CONNECT participation to the UTHealth School of Public Health, there are a TON of student who would not only be interested but well-equipped to work on these projects. (Classes like Intervention Mapping, Program Evaluation and Building a Needs Assessment are required.) If I can help connect you (ha!) in any way with UTHealth, let me know."
Ryan Carlino,CONNECT,A lot,A lot,A little,A moderate amount,A moderate amount,A lot,Moderately useful,Somewhat clear,Slightly too little,Yes,,Exceeds expectations,"I enjoyed having the opportunity to apply the data analysis skills that I learned at LBJ to a real project. I strengthened my skills in Tableau, Stata, Excel, and Piktochart through my work. I also employed a variety of quantitative data analysis skills. So, the project being focused on data analysis and visualization was a great way for me to exercise my knowledge. ","Make sure the project timeline and deliverables are as established pre-launch as possible. I was able to create visualizations, maps, analysis, etc. but much of the project is spilling into the summer. If I had only worked on the project for one semester, I would not have accomplished a lot on the to do list. ",A great deal,"Client support and instruction,Internet research,Other",Support from Alyssa,Yes,"The CONNECT program is a wonderful opportunity to LBJ students to apply and develop their skills and knowledge. My experience definitely improved my data analysis and visualization skills, and the project was instrumental in helping me find a long-term job after graduation. Given the short timeline of the project (one semester), the timing and planning should be tighter to ensure that student consultants can deliver as much as possible. Overall, I had a great experience. "
Timothy Michalak,CONNECT,A great deal,A lot,A great deal,A great deal,A great deal,A great deal,Moderately useful,Somewhat unclear,About right,Yes,,Exceeds expectations,Having latitude to take our client’s wishes and turning it into a product. ,Creating a project scope as a first step.,A great deal,"Client support and instruction,Instructor or program coordinator(s),Internet research",,Yes,
Daniel Vuong,CONNECT,A moderate amount,A little,A little,A moderate amount,A lot,A lot,Very useful,Somewhat clear,About right,Yes,,Exceeds expectations,"The degree of flexibility in deciding how and when to work on the project, the dynamics of working with just the client and the program coordinator.","Have a standardized method of communicating with us, the client, and the project coordinator.",A great deal,"Client support and instruction,Instructor or program coordinator(s),Internet research",,Yes,
Audrey Muntz,CONNECT,A moderate amount,A little,A moderate amount,A moderate amount,A lot,A moderate amount,Moderately useful,Extremely clear,About right,Yes,,Exceeds expectations,Having a couple of check-ins with MSDF was super helpful.  Working with Semonti and hearing how she thinks and what questions she asks was a huge part of the learning experience for me.  Also the resources Semonti provided (i.e. tools from other agencies) were very helpful and also helped in expanding how I thought about the project.   ,I think that if projects are similar then it might be helpful to have students brainstorm or share resources across projects.  Also a google drive resource library of previous projects or other useful resources could be helpful. ,A great deal,"Instructor or program coordinator(s),Program mentors",,Yes,
Julie Crookston,CONNECT,A lot,A lot,A lot,A lot,A lot,A lot,Very useful,Somewhat unclear,About right,Yes,,Equals expectations,Working in an independent fashion with a client. ,"Ideally pay wouldn't come through a fellowship, but I understand that is hard to change. ",A lot,"Client support and instruction,Internet research",,Yes,
Daniel Vuong,"CONNECT,Consulting for Social Impact Course",A lot,A moderate amount,A moderate amount,A moderate amount,A moderate amount,A moderate amount,Slightly useful,Somewhat clear,About right,Yes,,Equals expectations,Having regular client interactions was very helpful,Can't think of any aspect that really stands out as needing improvement.,A great deal,"Client support and instruction,Instructor or program coordinator(s)",,Yes,
